{
  "$schema": "https://json-schema.org/draft/2020-12/schema",
  "title": "Axis seed records of one entity",
  "type": "object",
  "additionalProperties": false,
  "required": ["id", "kind", "name", "formatVersion", "entity", "records"],
  "properties": {
    "id": { "$ref": "#/$defs/id" },
    "kind": { "const": "seed" },
    "name": { "$ref": "#/$defs/name" },
    "formatVersion": { "const": 1 },
    "entity": { "$ref": "#/$defs/name", "x-axis-reference": "entity" },
    "sync": { "type": "boolean" },
    "records": {
      "type": "array",
      "items": { "$ref": "#/$defs/record" }
    }
  },
  "$defs": {
    "id": {
      "type": "string",
      "format": "uuid",
      "pattern": "^[0-9a-fA-F]{8}-[0-9a-fA-F]{4}-[0-9a-fA-F]{4}-[0-9a-fA-F]{4}-[0-9a-fA-F]{12}$"
    },
    "name": {
      "type": "string",
      "pattern": "^[A-Za-z][A-Za-z0-9]*$",
      "maxLength": 60
    },
    "record": {
      "type": "object",
      "additionalProperties": false,
      "required": ["id", "values"],
      "properties": {
        "id": { "$ref": "#/$defs/id" },
        "values": { "type": "object" }
      }
    }
  }
}
